{
  "schema_version": "1.0",
  "id": "data-analysis-enabled",
  "label": "Data Analysis Skill enabled",
  "kind": "skill-enabled",
  "skills": [
    {
      "name": "data-analysis",
      "path": "skills/data-analysis"
    }
  ],
  "executor_config": {
    "skill_registry": "isolated",
    "routing": "natural"
  }
}
