{
  "schema_version": "1.0",
  "id": "shape-product-spec-enabled",
  "label": "Shape Product Spec Skill enabled",
  "kind": "skill-enabled",
  "skills": [
    {
      "name": "shape-product-spec",
      "path": "shape-product-spec"
    }
  ],
  "executor_config": {
    "skill_registry": "isolated",
    "routing": "natural"
  }
}
